{
  "decree_id": "DECREE-1792293374",
  "timestamp_utc": "2026-10-18T03:16:14.094603+00:00",
  "verdict": "VETO_BLOCKED",
  "anti_obsolescence_gate": {
    "passed": true,
    "target_framework": "net8.0",
    "deprecated_apis_detected": [],
    "binding_upgrades": []
  },
  "veto_registry": {
    "pen_tester_veto_active": true,
    "legal_counsel_veto_active": false,
    "blocking_reasons": [
      "[THE_PEN_TESTER] P0 Security Invariant: Endpoint missing InstituteId tenant isolation check."
    ]
  },
  "weighted_trade_offs_summary": [
    {
      "round": "Round 1: Speed vs. Conversion Debate",
      "topic": "Inject Schema.org and OpenGraph metadata to maximize organic candidate discovery. vs Zero tolerance for server-side render latency additions > 15ms.",
      "latency_impact": "Requires TTFB latency delta <= 6.0ms.",
      "conversion_impact": "+24.0% estimated organic conversion lift.",
      "accepted_rationale": "Accepted 6.0ms latency penalty in exchange for 24.0% conversion lift (Weighted Score: 60.0 >= 1.0 threshold)."
    },
    {
      "round": "Round 2: Security vs. Zero-Cost Debate",
      "topic": "Mandate strict tenant boundary enforcement, JWT verification, and SQLi defense. vs Enforce 50% system reserve and Strict Zero-Cost Invariant ($0.00 ceiling). No paid services allowed.",
      "latency_impact": "Spend: $0.00 / Paid Services: BLOCKED.",
      "conversion_impact": "P0 Exploit Prevention.",
      "accepted_rationale": "P0 Security Hard Veto is absolute. Budget/reserve constraints yield unconditionally to patch P0 exploit without incurring paid costs."
    },
    {
      "round": "Round 3: Liability vs. Aggressive Copy",
      "topic": "Maximize student exam completion and candidate onboarding with punchy, frictionless microcopy. vs Insulate platform from liability, copyright infringement on scanned papers, and student privacy violations.",
      "latency_impact": "FERPA / Regulatory compliance.",
      "conversion_impact": "Higher assessment completion rates.",
      "accepted_rationale": "Updated candidate exam instructions and upload notices with compliant disclaimers without harming UX clarity."
    }
  ],
  "auto_refactor_directives": [
    {
      "directive_id": "DIR-ROUND_1_SPEED_VS_CONVERSION",
      "target_file": "Examify/Views/Home/Index.cshtml",
      "action": "MODIFY",
      "summary": "Accepted 6.0ms latency penalty in exchange for 24.0% conversion lift (Weighted Score: 60.0 >= 1.0 threshold).",
      "unified_diff": "--- a/Examify/Views/Home/Index.cshtml\n+++ b/Examify/Views/Home/Index.cshtml\n@@ -12,3 +12,7 @@\n+ <script type=\"application/ld+json\">\n+ {\"@context\": \"https://schema.org\", \"@type\": \"Quiz\"}\n+ </script>",
      "compilation_impact": "RUNTIME_INTERPRETED_NO_BUILD",
      "verification_command": "Verify view markup in browser"
    },
    {
      "directive_id": "DIR-ROUND_2_SECURITY_VS_ZERO_COST",
      "target_file": "ExamifyAPI/Controllers/ExamController.cs",
      "action": "MODIFY",
      "summary": "P0 Security Hard Veto is absolute. Budget/reserve constraints yield unconditionally to patch P0 exploit without incurring paid costs.",
      "unified_diff": "--- a/ExamifyAPI/Controllers/ExamController.cs\n+++ b/ExamifyAPI/Controllers/ExamController.cs\n@@ -65,3 +65,6 @@\n+ var tenantId = GetInstituteIdFromClaim();\n+ if (exam.InstituteId != tenantId) return Forbid();",
      "compilation_impact": "REQUIRES_DOTNET_BUILD",
      "verification_command": "dotnet test ExamiFy.Tests/ExamiFy.Tests.csproj"
    },
    {
      "directive_id": "DIR-ROUND_3_LIABILITY_VS_AGGRESSIVE_COPY",
      "target_file": "Examify/Views/QuestionExtractor/Index.cshtml",
      "action": "MODIFY",
      "summary": "Updated candidate exam instructions and upload notices with compliant disclaimers without harming UX clarity.",
      "unified_diff": "--- a/Examify/Views/QuestionExtractor/Index.cshtml\n+++ b/Examify/Views/QuestionExtractor/Index.cshtml\n@@ -20,3 +20,4 @@\n+ <div class=\"legal-notice\">By uploading, you affirm you hold distribution rights.</div>",
      "compilation_impact": "RUNTIME_INTERPRETED_NO_BUILD",
      "verification_command": "Test question upload flow with disclaimer"
    }
  ]
}